USE test;
UPDATE vegetables SET id=10 WHERE vegetable='Cabbage';
SELECT * FROM vegetables;
id	vegetable
1	Broccoli
10	Cabbage
UPDATE vegetables SET id=20, vegetable="White Cabbage" WHERE id=10;
SELECT * FROM vegetables;
id	vegetable
1	Broccoli
20	White Cabbage
